<?xml version="1.0" encoding="UTF-8"?>
<modelAstrolabe version="1" xmlns:xsi="http://www.w3.org/2001/XMLSchema-instance" xsi:noNamespaceSchemaLocation="astrolabe.xsd">
	<astrolabeEpoch>
		<dCivic>
			<dcYear>2006</dcYear>
			<dcMonth>1</dcMonth>
			<dcDay>1.0</dcDay>
		</dCivic>
	</astrolabeEpoch>
	<astrolabeChart>
		<chartHemisphere>north</chartHemisphere>
		<chartView>up</chartView>
		<chartProjection>
			<projectionType>stereographic</projectionType>
			<projectionScale>100</projectionScale>
		</chartProjection>
		<chartUnit>mm</chartUnit>
		<!--equatorial-->
		<chartHorizon>
			<horizonType>
				<typeEquatorial>true</typeEquatorial>
			</horizonType>
			<horizonPracticality>always</horizonPracticality>
			<!--eqp-25, has dial-->
			<horizonCircle name="eqp-25">
				<circleType>
					<typeParallel>
						<parallelBegin>
							<lExplicit>
								<aDecimal>0.0</aDecimal>
							</lExplicit>
						</parallelBegin>
						<parallelEnd>
							<lExplicit>
								<aDecimal>360</aDecimal>
							</lExplicit>
						</parallelEnd>
						<parallelAltitude>
							<aDecimal>-25</aDecimal>
						</parallelAltitude>
					</typeParallel>
				</circleType>
				<circleImportance>canonical</circleImportance>
				<circleDial>
					<dBaseline>rail</dBaseline>
					<dUnit>hour-minute</dUnit>
					<dGraduation>
						<dgUnit>
							<dguInterval>30</dguInterval>
							<dguSubdivision>3</dguSubdivision>
							<dguAnnotation>
								<aText>
									<tRegular>30</tRegular>
									<tSuperscript>
										<tRegular>m</tRegular>
									</tSuperscript>
								</aText>
								<aPurpose>dialsubnumber</aPurpose>
								<aAnchor>middleleft</aAnchor>
							</dguAnnotation>
						</dgUnit>
						<dgFive>
							<dgfInterval>2</dgfInterval>
							<dgfAnnotation>
								<aText>
									<tRegular>@{dialCurrentInteger}@</tRegular>
									<tSuperscript>
										<tRegular>h</tRegular>
									</tSuperscript>
								</aText>
								<aPurpose>dialnumber</aPurpose>
								<aAnchor>middleleft</aAnchor>
							</dgfAnnotation>
						</dgFive>
					</dGraduation>
					<dAnnotation>
						<aText>
							<tRegular>Rektaszension (&#x0394;&#x03b1; 10</tRegular>
							<tSuperscript>
								<tRegular>m</tRegular>
							</tSuperscript>
						</aText>
						<aText>
							<tRegular>)</tRegular>
						</aText>
						<aPurpose>dialdescription</aPurpose>
						<aAnchor>bottommiddle</aAnchor>
						<aDistance>2.08</aDistance>
					</dAnnotation>
				</circleDial>
				<circleAnnotation>
					<aText>
						<tRegular>&#x03b4; @{circle}@&#x00b0;</tRegular>
					</aText>
					<aPurpose>guidance</aPurpose>
					<aAnchor>bottomright</aAnchor>
					<aDistance>12.5</aDistance>
					<aReverse>true</aReverse>
				</circleAnnotation><circleAnnotation>
					<aText>
						<tRegular>&#x03b4; @{circle}@&#x00b0;</tRegular>
					</aText>
					<aPurpose>guidance</aPurpose>
					<aAnchor>bottomright</aAnchor>
					<aDistance>50</aDistance>
					<aReverse>true</aReverse>
				</circleAnnotation><circleAnnotation>
					<aText>
						<tRegular>&#x03b4; @{circle}@&#x00b0;</tRegular>
					</aText>
					<aPurpose>guidance</aPurpose>
					<aAnchor>bottomright</aAnchor>
					<aDistance>87.5</aDistance>
					<aReverse>true</aReverse>
				</circleAnnotation>
			</horizonCircle>
			<!--southern tropic-->
			<horizonCircle>
				<circleType>
					<typeSouthernTropic>true</typeSouthernTropic>
				</circleType>
				<circleImportance>cardinal</circleImportance>
				<circleAnnotation>
					<aText>
						<tRegular>S&#x00fc;dlicher Sonnenwendekreis</tRegular>
					</aText>
					<aPurpose>circledescription</aPurpose>
					<aAnchor>bottommiddle</aAnchor>
					<aDistance>75</aDistance>
					<aReverse>true</aReverse>
				</circleAnnotation>
			</horizonCircle>
			<horizonCircle>
				<circleType>
					<typeParallel>
						<parallelBegin>
							<lExplicit>
								<aDecimal>0.0</aDecimal>
							</lExplicit>
						</parallelBegin>
						<parallelEnd>
							<lExplicit>
								<aDecimal>360</aDecimal>
							</lExplicit>
						</parallelEnd>
						<parallelAltitude>
							<aDecimal>-20</aDecimal>
						</parallelAltitude>
					</typeParallel>
				</circleType>
				<circleImportance>canonical</circleImportance>
			</horizonCircle>
			<horizonCircle>
				<circleType>
					<typeParallel>
						<parallelBegin>
							<lExplicit>
								<aDecimal>0.0</aDecimal>
							</lExplicit>
						</parallelBegin>
						<parallelEnd>
							<lExplicit>
								<aDecimal>360</aDecimal>
							</lExplicit>
						</parallelEnd>
						<parallelAltitude>
							<aDecimal>-10</aDecimal>
						</parallelAltitude>
					</typeParallel>
				</circleType>
				<circleImportance>canonical</circleImportance>
			</horizonCircle>
			<!--equator-->
			<horizonCircle>
				<circleType>
					<typeParallel>
						<parallelBegin>
							<lExplicit>
								<aDecimal>0.0</aDecimal>
							</lExplicit>
						</parallelBegin>
						<parallelEnd>
							<lExplicit>
								<aDecimal>360</aDecimal>
							</lExplicit>
						</parallelEnd>
						<parallelAltitude>
							<aDecimal>0</aDecimal>
						</parallelAltitude>
					</typeParallel>
				</circleType>
				<circleImportance>cardinal</circleImportance>
				<circleAnnotation>
					<aText>
						<tRegular>&#x00c4;quator</tRegular>
					</aText>
					<aPurpose>circledescription</aPurpose>
					<aAnchor>bottommiddle</aAnchor>
					<aDistance>75</aDistance>
					<aReverse>true</aReverse>
				</circleAnnotation>
			</horizonCircle>
			<horizonCircle>
				<circleType>
					<typeParallel>
						<parallelBegin>
							<lExplicit>
								<aDecimal>0.0</aDecimal>
							</lExplicit>
						</parallelBegin>
						<parallelEnd>
							<lExplicit>
								<aDecimal>360</aDecimal>
							</lExplicit>
						</parallelEnd>
						<parallelAltitude>
							<aDecimal>10</aDecimal>
						</parallelAltitude>
					</typeParallel>
				</circleType>
				<circleImportance>canonical</circleImportance>
			</horizonCircle>
			<horizonCircle>
				<circleType>
					<typeParallel>
						<parallelBegin>
							<lExplicit>
								<aDecimal>0.0</aDecimal>
							</lExplicit>
						</parallelBegin>
						<parallelEnd>
							<lExplicit>
								<aDecimal>360</aDecimal>
							</lExplicit>
						</parallelEnd>
						<parallelAltitude>
							<aDecimal>20</aDecimal>
						</parallelAltitude>
					</typeParallel>
				</circleType>
				<circleImportance>canonical</circleImportance>
			</horizonCircle>
			<!--northern tropic-->
			<horizonCircle>
				<circleType>
					<typeNorthernTropic>true</typeNorthernTropic>
				</circleType>
				<circleImportance>cardinal</circleImportance>
				<circleAnnotation>
					<aText>
						<tRegular>N&#x00f6;rdlicher Sonnenwendekreis</tRegular>
					</aText>
					<aPurpose>circledescription</aPurpose>
					<aAnchor>bottommiddle</aAnchor>
					<aDistance>75</aDistance>
				</circleAnnotation>
			</horizonCircle>
			<horizonCircle>
				<circleType>
					<typeParallel>
						<parallelBegin>
							<lExplicit>
								<aDecimal>0.0</aDecimal>
							</lExplicit>
						</parallelBegin>
						<parallelEnd>
							<lExplicit>
								<aDecimal>360</aDecimal>
							</lExplicit>
						</parallelEnd>
						<parallelAltitude>
							<aDecimal>30</aDecimal>
						</parallelAltitude>
					</typeParallel>
				</circleType>
				<circleImportance>canonical</circleImportance>
			</horizonCircle>
			<horizonCircle>
				<circleType>
					<typeParallel>
						<parallelBegin>
							<lExplicit>
								<aDecimal>0.0</aDecimal>
							</lExplicit>
						</parallelBegin>
						<parallelEnd>
							<lExplicit>
								<aDecimal>360</aDecimal>
							</lExplicit>
						</parallelEnd>
						<parallelAltitude>
							<aDecimal>40</aDecimal>
						</parallelAltitude>
					</typeParallel>
				</circleType>
				<circleImportance>canonical</circleImportance>
			</horizonCircle>
			<horizonCircle>
				<circleType>
					<typeParallel>
						<parallelBegin>
							<lExplicit>
								<aDecimal>0.0</aDecimal>
							</lExplicit>
						</parallelBegin>
						<parallelEnd>
							<lExplicit>
								<aDecimal>360</aDecimal>
							</lExplicit>
						</parallelEnd>
						<parallelAltitude>
							<aDecimal>50</aDecimal>
						</parallelAltitude>
					</typeParallel>
				</circleType>
				<circleImportance>canonical</circleImportance>
			</horizonCircle>
			<horizonCircle>
				<circleType>
					<typeParallel>
						<parallelBegin>
							<lExplicit>
								<aDecimal>0.0</aDecimal>
							</lExplicit>
						</parallelBegin>
						<parallelEnd>
							<lExplicit>
								<aDecimal>360</aDecimal>
							</lExplicit>
						</parallelEnd>
						<parallelAltitude>
							<aDecimal>60</aDecimal>
						</parallelAltitude>
					</typeParallel>
				</circleType>
				<circleImportance>canonical</circleImportance>
			</horizonCircle>
			<horizonCircle>
				<circleType>
					<typeParallel>
						<parallelBegin>
							<lExplicit>
								<aDecimal>0.0</aDecimal>
							</lExplicit>
						</parallelBegin>
						<parallelEnd>
							<lExplicit>
								<aDecimal>360</aDecimal>
							</lExplicit>
						</parallelEnd>
						<parallelAltitude>
							<aDecimal>70</aDecimal>
						</parallelAltitude>
					</typeParallel>
				</circleType>
				<circleImportance>canonical</circleImportance>
			</horizonCircle>
			<horizonCircle>
				<circleType>
					<typeParallel>
						<parallelBegin>
							<lExplicit>
								<aDecimal>0.0</aDecimal>
							</lExplicit>
						</parallelBegin>
						<parallelEnd>
							<lExplicit>
								<aDecimal>360</aDecimal>
							</lExplicit>
						</parallelEnd>
						<parallelAltitude>
							<aDecimal>80</aDecimal>
						</parallelAltitude>
					</typeParallel>
				</circleType>
				<circleImportance>canonical</circleImportance>
			</horizonCircle>
			<!--meridians-->
			<horizonCircle>
				<circleType>
					<typeMeridian>
						<meridianBegin>
							<lExplicit>
								<aDecimal>-25</aDecimal>
							</lExplicit>
						</meridianBegin>
						<meridianEnd>
							<lExplicit>